{
  "id": "P01-G01",
  "title": "User Dashboard",
  "phase": "P01",
  "revision": 1,
  "state": "LOCKED",
  "objective": "Build accessible SaaS analytics dashboard.",
  "constraints": [],
  "non_goals": [],
  "acceptance": [
    "Passes WCAG AA contrast check",
    "Renders chart components"
  ],
  "gates": {
    "build": "required",
    "tests": "required",
    "review": "required",
    "documentation_impact": "required",
    "project_intelligence": "required"
  },
  "context": {
    "budget_profile": "medium",
    "max_delegation_depth": 1
  },
  "dependencies": [],
  "evidence": [],
  "history": [
    {
      "at": "2026-08-14T20:16:09.532227+00:00",
      "event": "created",
      "state": "DRAFT"
    },
    {
      "at": "2026-08-14T20:16:09.532534+00:00",
      "event": "state-transition",
      "from": "DRAFT",
      "to": "PLANNED",
      "reason": ""
    },
    {
      "at": "2026-08-14T20:16:09.532919+00:00",
      "event": "state-transition",
      "from": "PLANNED",
      "to": "LOCKED",
      "reason": ""
    }
  ],
  "lock": {
    "revision": 1,
    "digest": "d2533c02c3a102045055b331653326acb0e310c94fd9920cb54aaee980a9c245",
    "locked_at": "2026-08-14T20:16:09.532902+00:00"
  }
}
