{
  "id": "P01-G01",
  "title": "Desktop Editor Window",
  "phase": "P01",
  "revision": 1,
  "state": "LOCKED",
  "objective": "Render native multi-tab editor view.",
  "constraints": [],
  "non_goals": [],
  "acceptance": [
    "Runs 60 FPS under typical workload",
    "Undo/redo operates deterministically"
  ],
  "gates": {
    "build": "required",
    "tests": "required",
    "review": "required",
    "documentation_impact": "required",
    "project_intelligence": "required"
  },
  "context": {
    "budget_profile": "medium",
    "max_delegation_depth": 1
  },
  "dependencies": [],
  "evidence": [],
  "history": [
    {
      "at": "2026-08-14T20:16:09.541370+00:00",
      "event": "created",
      "state": "DRAFT"
    },
    {
      "at": "2026-08-14T20:16:09.541646+00:00",
      "event": "state-transition",
      "from": "DRAFT",
      "to": "PLANNED",
      "reason": ""
    },
    {
      "at": "2026-08-14T20:16:09.542007+00:00",
      "event": "state-transition",
      "from": "PLANNED",
      "to": "LOCKED",
      "reason": ""
    }
  ],
  "lock": {
    "revision": 1,
    "digest": "993681f2e7288c64c136a10da87853fb98acc69e5f0274cfb92ced6afb625b8f",
    "locked_at": "2026-08-14T20:16:09.541998+00:00"
  }
}
