{
  "id": "P01-G01",
  "title": "Scheduler & Process Supervisor",
  "phase": "P01",
  "revision": 1,
  "state": "LOCKED",
  "objective": "Implement async task scheduler and ACP harness supervisor in Rust.",
  "constraints": [],
  "non_goals": [],
  "acceptance": [
    "Executes DAG tasks with bounded concurrency",
    "Emits structured Event Protocol stream",
    "Isolates subprocesses securely"
  ],
  "gates": {
    "build": "required",
    "tests": "required",
    "review": "required",
    "documentation_impact": "required",
    "project_intelligence": "required"
  },
  "context": {
    "budget_profile": "medium",
    "max_delegation_depth": 1
  },
  "dependencies": [],
  "evidence": [],
  "history": [
    {
      "at": "2026-08-14T20:16:09.558514+00:00",
      "event": "created",
      "state": "DRAFT"
    },
    {
      "at": "2026-08-14T20:16:09.558816+00:00",
      "event": "state-transition",
      "from": "DRAFT",
      "to": "PLANNED",
      "reason": ""
    },
    {
      "at": "2026-08-14T20:16:09.559557+00:00",
      "event": "state-transition",
      "from": "PLANNED",
      "to": "LOCKED",
      "reason": ""
    }
  ],
  "lock": {
    "revision": 1,
    "digest": "5edf9684e39ef2cbebb265abe0dba60c9e8767dfcab5c18d1753e30ede77d6f1",
    "locked_at": "2026-08-14T20:16:09.559537+00:00"
  }
}
